title,creation_date,score,link,tags,is_answered
Getting RFKK_MA_SCHEDULER parameter values,1629377827,0,https://stackoverflow.com/questions/68848319/getting-rfkk-ma-scheduler-parameter-values,"parameters, report, abap, sap-erp, function-module",False
Reading text in Table Control,1628273381,2,https://stackoverflow.com/questions/68685911/reading-text-in-table-control,"excel, vba, sap-erp, sap-gui",True
SAP MDG see Change Documents of a given Business Partner?,1624389441,1,https://stackoverflow.com/questions/68089581/sap-mdg-see-change-documents-of-a-given-business-partner,"sap-erp, master-data-management",True
How to check NOT NULL when calling RFC_READ_TABLE?,1623913693,1,https://stackoverflow.com/questions/68014515/how-to-check-not-null-when-calling-rfc-read-table,"python, sap-erp, saprfc, pyrfc",True
Query SAP ECC6 user create view in Azure Data Factory,1623694480,0,https://stackoverflow.com/questions/67975268/query-sap-ecc6-user-create-view-in-azure-data-factory,"azure, view, azure-data-factory, abap, sap-erp",False
User Exit or BAdI for VA01 partners tab,1623660456,1,https://stackoverflow.com/questions/67967288/user-exit-or-badi-for-va01-partners-tab,"abap, sap-erp",True
Misinterpretation of fields containing &quot; when importing text file with tab delimiter,1622741246,0,https://stackoverflow.com/questions/67826060/misinterpretation-of-fields-containing-when-importing-text-file-with-tab-delim,"excel, vba, delimiter, sap-erp",False
Are there any transactional Tables in the SAP Module MM?,1620996080,0,https://stackoverflow.com/questions/67534522/are-there-any-transactional-tables-in-the-sap-module-mm,sap-erp,False
VA01 BDC_OKCODE /00 not working as expected,1620988905,1,https://stackoverflow.com/questions/67532990/va01-bdc-okcode-00-not-working-as-expected,"abap, sap-erp",True
How to configure SAP SNC using Docker,1620128669,2,https://stackoverflow.com/questions/67384132/how-to-configure-sap-snc-using-docker,"dockerfile, sap-erp, saprfc, sap-basis",True
Suppress Print Dialogue Box in BDC SAP,1619441575,0,https://stackoverflow.com/questions/67267018/suppress-print-dialogue-box-in-bdc-sap,"abap, sap-erp",False
SAP Logic apps create creditor with input parameter,1618910054,0,https://stackoverflow.com/questions/67175929/sap-logic-apps-create-creditor-with-input-parameter,"azure-logic-apps, sap-erp, bapi",False
"Login SAP, with Powershell using SAP Connector for Microsoft .NET",1617183571,-1,https://stackoverflow.com/questions/66885217/login-sap-with-powershell-using-sap-connector-for-microsoft-net,".net, powershell, sap-erp, sap-gui",False
Release group and Release Strategy fields not filled in Service Entry Sheet(SES),1616160263,0,https://stackoverflow.com/questions/66709025/release-group-and-release-strategy-fields-not-filled-in-service-entry-sheetses,"abap, sap-erp, dynpro",True
accented characters not copied correctly from Access to SAP intermittently,1616075304,0,https://stackoverflow.com/questions/66692450/accented-characters-not-copied-correctly-from-access-to-sap-intermittently,"ms-access, sap-erp",False
Is it possible to change default system displaying for F4 help programmatically?,1616055771,1,https://stackoverflow.com/questions/66687214/is-it-possible-to-change-default-system-displaying-for-f4-help-programmatically,"abap, sap-erp, netweaver",False
How do I have to config my pc to view pdf documents in SAP Logon?,1615753256,0,https://stackoverflow.com/questions/66629151/how-do-i-have-to-config-my-pc-to-view-pdf-documents-in-sap-logon,"pdf, ascii, sap-erp, sap-gui",False
Implement two SELECT DISTINCT in one query?,1615322876,0,https://stackoverflow.com/questions/66554551/implement-two-select-distinct-in-one-query,"java, mysql, sql, sap-erp",True
Determine SAP Document Type changes during the year,1615313903,1,https://stackoverflow.com/questions/66552594/determine-sap-document-type-changes-during-the-year,"sap-erp, document-types",True
Run background JOB with COGI without changing the screens,1615229913,0,https://stackoverflow.com/questions/66535601/run-background-job-with-cogi-without-changing-the-screens,"transactions, background, abap, jobs, sap-erp",False
Standard report missing critical data,1615203566,0,https://stackoverflow.com/questions/66529164/standard-report-missing-critical-data,"finance, sap-erp",False
How to change zgrup field of customers with CMD_EI_API=&gt;MAINTAIN_BAPI?,1614793413,1,https://stackoverflow.com/questions/66462199/how-to-change-zgrup-field-of-customers-with-cmd-ei-api-maintain-bapi,"abap, sap-erp",False
Query fields from different mysql tables,1614260432,0,https://stackoverflow.com/questions/66369665/query-fields-from-different-mysql-tables,"mysql, sql, database, sap-erp",True
SAP GRC case start date and due date location in tables,1614003232,0,https://stackoverflow.com/questions/66317354/sap-grc-case-start-date-and-due-date-location-in-tables,sap-erp,False
How to extend &quot;Create with reference&quot; dialog in VA01/02,1612529222,1,https://stackoverflow.com/questions/66063560/how-to-extend-create-with-reference-dialog-in-va01-02,"sap-erp, dynpro",False
"Decimal separator issue from SAP to Excel: &quot;1,056&quot; versus &quot;1.056&quot; (factor 1000)",1612371579,0,https://stackoverflow.com/questions/66032175/decimal-separator-issue-from-sap-to-excel-1-056-versus-1-056-factor-1000,"vba, numbers, excel-2010, sap-erp, cell-formatting",False
BAPI to get customer company?,1612342993,1,https://stackoverflow.com/questions/66024259/bapi-to-get-customer-company,"abap, sap-erp, bapi, function-module",True
How to integrate web app with SAP EWM RF functions,1611656801,0,https://stackoverflow.com/questions/65899596/how-to-integrate-web-app-with-sap-ewm-rf-functions,"html, web-applications, progressive-web-apps, sap-erp",True
Custom fields not showing on table output,1610553221,0,https://stackoverflow.com/questions/65705365/custom-fields-not-showing-on-table-output,"abap, sap-erp",True
SAP query - BSEG and BKPF,1610465564,1,https://stackoverflow.com/questions/65687026/sap-query-bseg-and-bkpf,"sap-erp, sap-query",True
SAP S/4HANA On-Prem REST API,1610123008,1,https://stackoverflow.com/questions/65632704/sap-s-4hana-on-prem-rest-api,"sap-erp, sap-cloud-connector",False
How to call BAPI_MATERIAL_SAVEDATA with custom fields from NCo?,1607516411,1,https://stackoverflow.com/questions/65216665/how-to-call-bapi-material-savedata-with-custom-fields-from-nco,"bapi, sap-dotnet-connector, sap-erp",True
How to check when data is changed in ALV specific field?,1607011823,0,https://stackoverflow.com/questions/65129710/how-to-check-when-data-is-changed-in-alv-specific-field,"abap, sap-erp",True
SAP: join partner function data based on sales type,1606918782,0,https://stackoverflow.com/questions/65109918/sap-join-partner-function-data-based-on-sales-type,sap-erp,True
Quarkus and provided dependencies (sapjco3.jar),1606302951,1,https://stackoverflow.com/questions/65003590/quarkus-and-provided-dependencies-sapjco3-jar,"java, maven, quarkus, sap-erp",True
How to show an editable itab in a popup?,1606293829,1,https://stackoverflow.com/questions/65001185/how-to-show-an-editable-itab-in-a-popup,"abap, alv, dynpro, sap-erp",False
Catching user input from popup with validation?,1604932446,2,https://stackoverflow.com/questions/64753614/catching-user-input-from-popup-with-validation,"validation, abap, dynpro, sap-erp",True
Delete from C_t_data for Bi Extractor,1604059880,0,https://stackoverflow.com/questions/64608118/delete-from-c-t-data-for-bi-extractor,"abap, sap-bw, sap-erp",False
Eclipse shows login screen on start of an ABAP program,1603100666,1,https://stackoverflow.com/questions/64424849/eclipse-shows-login-screen-on-start-of-an-abap-program,"eclipse, abap, sap-erp",False
Join KNA1 table to VBRK,1600591852,-1,https://stackoverflow.com/questions/63977159/join-kna1-table-to-vbrk,"sql, abap, sap-erp",True
How to get a VBA script to work for variable field?,1599021527,0,https://stackoverflow.com/questions/63698799/how-to-get-a-vba-script-to-work-for-variable-field,"vba, sap-gui, sap-erp",False
How to use fields/tables of MB51 Tcode in an ABAP report,1598516435,0,https://stackoverflow.com/questions/63611929/how-to-use-fields-tables-of-mb51-tcode-in-an-abap-report,"abap, sap-erp",True
CHVW Table in SAP is not updating for a specific date,1598345220,0,https://stackoverflow.com/questions/63575203/chvw-table-in-sap-is-not-updating-for-a-specific-date,sap-erp,False
cmd_ei_api=&gt;maintain_bapi to update kna1 table field (ICMSTAXPAY),1597911870,0,https://stackoverflow.com/questions/63501120/cmd-ei-api-maintain-bapi-to-update-kna1-table-field-icmstaxpay,"abap, sap-erp",True
How do I make a loop in SAP VBA script,1597399611,1,https://stackoverflow.com/questions/63410741/how-do-i-make-a-loop-in-sap-vba-script,"excel, vba, sap-erp",True
Using SUBSTRING in JOIN condition,1597232157,0,https://stackoverflow.com/questions/63375679/using-substring-in-join-condition,"substring, abap, opensql, sap-erp",False
Error connecting with SAP ERP System with Pentaho ETL tool,1597068809,3,https://stackoverflow.com/questions/63341943/error-connecting-with-sap-erp-system-with-pentaho-etl-tool,"database, etl, pentaho, pentaho-data-integration, sap-erp",False
How individual code is run inside an ERP application like SAP or Dynamics NAV,1596898833,0,https://stackoverflow.com/questions/63316826/how-individual-code-is-run-inside-an-erp-application-like-sap-or-dynamics-nav,"c#, abap, dynamics-nav, sap-erp",True
"Is BAPI_MATERIAL_GET_ALL a BAPI, or just a RFC?",1594286740,0,https://stackoverflow.com/questions/62811689/is-bapi-material-get-all-a-bapi-or-just-a-rfc,"sap-erp, saprfc, bapi",True
Is there a way to get a BOM style output (SAP CS12) from a set of parent child relationships in R?,1594157801,2,https://stackoverflow.com/questions/62784294/is-there-a-way-to-get-a-bom-style-output-sap-cs12-from-a-set-of-parent-child-r,"r, sap-erp",False
How to &quot;Click&quot; on the green arrow shown in image [SAP welcome screen],1590645150,0,https://stackoverflow.com/questions/62057888/how-to-click-on-the-green-arrow-shown-in-image-sap-welcome-screen,"excel, vba, scripting, sap-erp, sap-gui",False
SAP process session txt no taking input column,1590416669,0,https://stackoverflow.com/questions/62004441/sap-process-session-txt-no-taking-input-column,sap-erp,True
Azure Data Factory SAP ECC OData connection parameters,1588759216,1,https://stackoverflow.com/questions/61632349/azure-data-factory-sap-ecc-odata-connection-parameters,"odata, azure-data-factory, sap-erp, sap-gateway",False
Interfacing C++ with SAP ERP,1586972955,0,https://stackoverflow.com/questions/61235273/interfacing-c-with-sap-erp,"c++, sap-erp, saprfc",True
Call CJ20N transaction from C#,1586224001,1,https://stackoverflow.com/questions/61071539/call-cj20n-transaction-from-c,"c#, .net, sap-erp, bapi, sap-dotnet-connector",False
Powershell Invoke-WebRequest submit form SAP,1585689702,0,https://stackoverflow.com/questions/60960085/powershell-invoke-webrequest-submit-form-sap,"powershell, sap-erp, invoke-webrequest",False
Set a variable dynamically within a SELECT statement,1583491295,4,https://stackoverflow.com/questions/60562366/set-a-variable-dynamically-within-a-select-statement,"sql, sql-server, database, sap-erp, sql-data-warehouse",True
RFC-enabled function module to update physical samples,1582795611,1,https://stackoverflow.com/questions/60429968/rfc-enabled-function-module-to-update-physical-samples,"sap-erp, saprfc, bapi, function-module",True
Table for complaint storage statuses?,1582705190,0,https://stackoverflow.com/questions/60409532/table-for-complaint-storage-statuses,"sap-erp, sap-dotnet-connector, sap-r3",True
How do I extract non-HANA ECC tables into R?,1580788363,1,https://stackoverflow.com/questions/60050334/how-do-i-extract-non-hana-ecc-tables-into-r,"r, sap-erp",True
User Defined Program to calculate fields,1580425372,0,https://stackoverflow.com/questions/59995804/user-defined-program-to-calculate-fields,"java, integration, logical-operators, sap-erp, sap-xi",False
SAP HANA SDI ECC Source vs HANA table delta,1579620708,0,https://stackoverflow.com/questions/59844376/sap-hana-sdi-ecc-source-vs-hana-table-delta,"hana, sap-erp",True
Calling BAPI from Java using SAP Cloud SDK version 3.0,1579239052,2,https://stackoverflow.com/questions/59781710/calling-bapi-from-java-using-sap-cloud-sdk-version-3-0,"sap-erp, sap-cloud-sdk, bapi",True
Getting FAGLL03H report using pyrfc,1578954746,2,https://stackoverflow.com/questions/59725142/getting-fagll03h-report-using-pyrfc,"python-3.x, sap-erp, saprfc, pyrfc",True
"For SAP GUI script, do you know what is the script for SAP job has been created?",1578381219,0,https://stackoverflow.com/questions/59623776/for-sap-gui-script-do-you-know-what-is-the-script-for-sap-job-has-been-created,"excel, typescript, sap-erp, sap-gui",False
Count rows in table behind CA70,1577427212,-1,https://stackoverflow.com/questions/59496711/count-rows-in-table-behind-ca70,sap-erp,False
BAPI_ACTTYPE_CHANGEMULTIPLE returns empty and doesn&#39;t change anything in the Database,1575376717,-2,https://stackoverflow.com/questions/59157330/bapi-acttype-changemultiple-returns-empty-and-doesnt-change-anything-in-the-dat,"c#, erp, sap-erp, saprfc, bapi",True
Link EKPO-EBELP and G/L accounts,1573129046,1,https://stackoverflow.com/questions/58748624/link-ekpo-ebelp-and-g-l-accounts,"sql, amazon-redshift, sap-erp",True
401 Not Authorized error in soapUI but web service works perfect in Postman,1571673265,1,https://stackoverflow.com/questions/58489934/401-not-authorized-error-in-soapui-but-web-service-works-perfect-in-postman,"soap, postman, soapui, sap-erp",True
How to link JS to SAP API development work,1568778980,0,https://stackoverflow.com/questions/57984885/how-to-link-js-to-sap-api-development-work,"javascript, html, directory, sap-erp, bapi",False
AMAZON EDI / required payer name in NAD+IV segment is longer than 35 character limit,1567764186,1,https://stackoverflow.com/questions/57819870/amazon-edi-required-payer-name-in-nadiv-segment-is-longer-than-35-character-l,"sap-erp, edi, edifact",True
List of tables that leave traces in CDHDR and CDPOS tables,1566989024,0,https://stackoverflow.com/questions/57690595/list-of-tables-that-leave-traces-in-cdhdr-and-cdpos-tables,"abap, hana, sap-erp, sap-cloud-connector",True
SAP data extraction through BAPI file in Automation Anywhere,1566974339,0,https://stackoverflow.com/questions/57686351/sap-data-extraction-through-bapi-file-in-automation-anywhere,"automation, rpa, sap-erp, automationanywhere, bapi",False
SAP Report with Assets and Useful Life?,1565339407,0,https://stackoverflow.com/questions/57426229/sap-report-with-assets-and-useful-life,"sap-erp, accounting",True
What is the best way to transfer data from SAP to SQL Server?,1565170135,4,https://stackoverflow.com/questions/57391164/what-is-the-best-way-to-transfer-data-from-sap-to-sql-server,"ssis, etl, data-warehouse, sap-erp, sap-dotnet-connector",True
Which SAP table do I need to find annual sales?,1563802628,-3,https://stackoverflow.com/questions/57147290/which-sap-table-do-i-need-to-find-annual-sales,"calculation, sap-erp, database-table, sap-bw",True
ME21N order quantity violates rounding rules,1562299045,-1,https://stackoverflow.com/questions/56896364/me21n-order-quantity-violates-rounding-rules,"excel, vba, sap-erp",True
Web services in SAP are available by default?,1562050436,1,https://stackoverflow.com/questions/56846875/web-services-in-sap-are-available-by-default,"web-services, .net-core, sap-erp, sap-dotnet-connector",True
General error;383 invalid identifier: RESB: on inner join,1559744848,0,https://stackoverflow.com/questions/56462543/general-error383-invalid-identifier-resb-on-inner-join,"sql, sap-erp",False
Retreiving ship-to-party country SAP QuickViewer,1559136832,0,https://stackoverflow.com/questions/56361864/retreiving-ship-to-party-country-sap-quickviewer,"sap-erp, sap-query",True
User Exit for Reason of Rejection VA01,1558966072,1,https://stackoverflow.com/questions/56327685/user-exit-for-reason-of-rejection-va01,"abap, sap-erp",False
Extracting Data from SAP to SQL Server,1557932948,3,https://stackoverflow.com/questions/56152541/extracting-data-from-sap-to-sql-server,"sql-server, ssis, sap-erp",True
How to extract the output of called program RAZUGA01,1556642535,-1,https://stackoverflow.com/questions/55925403/how-to-extract-the-output-of-called-program-razuga01,"abap, sap-erp",True
collecting infos about SAP ERP,1556296117,-3,https://stackoverflow.com/questions/55871647/collecting-infos-about-sap-erp,"sap-erp, s4hana",True
Convert PRPS POSID to formatted WBS Element out of SAP,1554713200,0,https://stackoverflow.com/questions/55569449/convert-prps-posid-to-formatted-wbs-element-out-of-sap,"java, sql, sap-erp",True
Function modules to update table BSID (field: cession_kz),1554473449,1,https://stackoverflow.com/questions/55537296/function-modules-to-update-table-bsid-field-cession-kz,"abap, sap-erp",True
Unable to record SAP BPC with loadrunner or fiddler,1554377486,0,https://stackoverflow.com/questions/55514907/unable-to-record-sap-bpc-with-loadrunner-or-fiddler,"fiddler, loadrunner, sap-erp, netweaver, sap-bw",False
How does API based data integration work?,1554355152,1,https://stackoverflow.com/questions/55508380/how-does-api-based-data-integration-work,"integration, sap-erp, bapi, idoc",True
"I want to hide some fields from the standard screen QM01/QM02/QM03 like Delivery,Delivery Item and also adding some custom fields.How to achieve it?",1553510923,-8,https://stackoverflow.com/questions/55336082/i-want-to-hide-some-fields-from-the-standard-screen-qm01-qm02-qm03-like-delivery,"abap, sap-erp",False
CO currency for settlement process in CJ88,1552518335,0,https://stackoverflow.com/questions/55152473/co-currency-for-settlement-process-in-cj88,"customization, sap-erp",False
How to construct a selector based on dynamic ctrlid through UiPath?,1551250555,0,https://stackoverflow.com/questions/54899709/how-to-construct-a-selector-based-on-dynamic-ctrlid-through-uipath,"windows, uipath, sap-erp, sap-gui, uipath-studio",True
Why does the ctrlid format detected by UiPath differs from the documented format in their XSLT representation?,1550674857,5,https://stackoverflow.com/questions/54789304/why-does-the-ctrlid-format-detected-by-uipath-differs-from-the-documented-format,"windows, xslt, msdn, uipath, sap-erp",True
How to create LONGTEXTS with BAPI_QUALNOT_CREATE in SAP?,1550243003,1,https://stackoverflow.com/questions/54712022/how-to-create-longtexts-with-bapi-qualnot-create-in-sap,"java, abap, jco, sap-erp",True
Design Class for deep copy of SAP PS Project object,1549630617,0,https://stackoverflow.com/questions/54592967/design-class-for-deep-copy-of-sap-ps-project-object,"oop, abap, sap-erp",True
Select last 30 days rows from MARA using SSIS,1549531487,0,https://stackoverflow.com/questions/54570034/select-last-30-days-rows-from-mara-using-ssis,"sql, ssis, opensql, sap-erp",True
UiPath -Error {&quot;message&quot;:&quot;Click Text &#39;SAPTreeList&#39;: Cannot find the UI element corresponding to this selector: &lt;wnd ctrlid=&#39;90279688&#39; /&gt;,1549442317,6,https://stackoverflow.com/questions/54549466/uipath-error-messageclick-text-saptreelist-cannot-find-the-ui-element-c,"uipath, sap-erp, sap-gui, uipath-studio",True
Formal parameter &quot;IV_SPECIAL_FUND_RED&quot; does not exist after note 2443042,1549035009,0,https://stackoverflow.com/questions/54482488/formal-parameter-iv-special-fund-red-does-not-exist-after-note-2443042,"parameters, abap, sap-erp",True
MIRO BADI message,1548496584,0,https://stackoverflow.com/questions/54377315/miro-badi-message,"abap, sap-erp, badi",False
Not able to extract SAP Data into .xlsx format,1548328768,0,https://stackoverflow.com/questions/54345410/not-able-to-extract-sap-data-into-xlsx-format,"excel, vba, sap-gui, sap-erp",False
SAP L_TO_CANCEL doesn&#39;t cancel transfer order,1547984325,0,https://stackoverflow.com/questions/54276049/sap-l-to-cancel-doesnt-cancel-transfer-order,"python, sap-erp, saprfc, pyrfc",False
Custom Search Help from Application Server Directory ABAP,1546155834,0,https://stackoverflow.com/questions/53976000/custom-search-help-from-application-server-directory-abap,"abap, sap-erp",True
changing the validity of lots when making an MIGO,1546018657,0,https://stackoverflow.com/questions/53962282/changing-the-validity-of-lots-when-making-an-migo,"abap, sap-erp",False
Update Total Val. in Item overview,1546007710,1,https://stackoverflow.com/questions/53960158/update-total-val-in-item-overview,"abap, sap-erp",True
Restrict se16n to some table rows,1545302550,2,https://stackoverflow.com/questions/53867058/restrict-se16n-to-some-table-rows,"abap, sap-erp",True
Tables related to table T012,1545295335,0,https://stackoverflow.com/questions/53865094/tables-related-to-table-t012,sap-erp,False
How to extract SAP ERP data for a particular year,1544834031,-1,https://stackoverflow.com/questions/53788541/how-to-extract-sap-erp-data-for-a-particular-year,"sap-erp, jco, sapjco3",True
How to run IW29 with a specific variation and layout and copy its outcome to excel?,1544485463,0,https://stackoverflow.com/questions/53715383/how-to-run-iw29-with-a-specific-variation-and-layout-and-copy-its-outcome-to-exc,"excel, sap-gui, sap-erp",True
How to find ForeignKey in SAP Dictionary tables?,1544453409,5,https://stackoverflow.com/questions/53708115/how-to-find-foreignkey-in-sap-dictionary-tables,"abap, sap-erp, sap-data-dictionary",True
Get sales orders from Amazon MWS scratchpad via API,1542364591,1,https://stackoverflow.com/questions/53336092/get-sales-orders-from-amazon-mws-scratchpad-via-api,"postman, soapui, amazon-mws, sap-erp",True
How to access SAP Cloud Integration tool?,1542189265,0,https://stackoverflow.com/questions/53297342/how-to-access-sap-cloud-integration-tool,"sap-cloud-platform, sap-erp, sap-successfactors",False
SUM authentication issue with saphostctrl – Authentication Required,1541579294,0,https://stackoverflow.com/questions/53185764/sum-authentication-issue-with-saphostctrl-authentication-required,"sap-erp, sap-basis",False
SAP JCo invoking BAPI_MATERIAL_DISPLAY,1540829683,0,https://stackoverflow.com/questions/53049660/sap-jco-invoking-bapi-material-display,"sap-erp, saprfc, sapjco3",True
How to test for long text window? IW31,1540508582,0,https://stackoverflow.com/questions/52999262/how-to-test-for-long-text-window-iw31,"sap-gui, sap-erp",False
Excel VBScript not activating ECC 6.0 WIndow,1540177325,1,https://stackoverflow.com/questions/52921873/excel-vbscript-not-activating-ecc-6-0-window,"sap-erp, sap-gui",False
EKPO fields not updated after PROCESS_ITEM method set_data in ME21N,1540174552,0,https://stackoverflow.com/questions/52921599/ekpo-fields-not-updated-after-process-item-method-set-data-in-me21n,"abap, sap-erp",False
Custom field FB02 SAPMF05L Dynpro 1710,1539427151,0,https://stackoverflow.com/questions/52792041/custom-field-fb02-sapmf05l-dynpro-1710,"abap, sap-erp",False
Exception raised after posting gl account data to bapi_incominginvoice_create1,1539163913,1,https://stackoverflow.com/questions/52736997/exception-raised-after-posting-gl-account-data-to-bapi-incominginvoice-create1,"abap, bapi, sap-erp",True
How to create Selection and connecting output of deliveries and positions of delivery,1539160125,0,https://stackoverflow.com/questions/52735838/how-to-create-selection-and-connecting-output-of-deliveries-and-positions-of-del,"abap, opensql, sap-erp",True
The SAP ERP organizational structure,1537785569,0,https://stackoverflow.com/questions/52477520/the-sap-erp-organizational-structure,"data-structures, organization, sap-erp",False
Change Payment Block programmatically in MIRO tcode?,1536147852,2,https://stackoverflow.com/questions/52184354/change-payment-block-programmatically-in-miro-tcode,"abap, bapi, sap-erp",True
Upload multiple sheet Excel into internal table,1536059863,2,https://stackoverflow.com/questions/52165111/upload-multiple-sheet-excel-into-internal-table,"excel, abap, sap-erp",True
BAPI for getting material and order BOM?,1535911498,1,https://stackoverflow.com/questions/52139752/bapi-for-getting-material-and-order-bom,"abap, bapi, sap-erp",False
Call AFIP MTXCA web-service properly from SAP ECC,1535735944,0,https://stackoverflow.com/questions/52120121/call-afip-mtxca-web-service-properly-from-sap-ecc,"abap, sap-erp",True
UDM_DISPUTE: Templates don&#39;t load first time,1535100845,1,https://stackoverflow.com/questions/52000814/udm-dispute-templates-dont-load-first-time,sap-erp,False
Establishing trusted communication between SAP and C# using X509 certificates and .NET Connector,1534157325,0,https://stackoverflow.com/questions/51820589/establishing-trusted-communication-between-sap-and-c-using-x509-certificates-an,".net, x509, sap-erp, trusted",False
How can I Import SAP txt file into SQL Server Express 2017?,1532708629,-2,https://stackoverflow.com/questions/51561965/how-can-i-import-sap-txt-file-into-sql-server-express-2017,"sql, sql-server, ssms, sap-erp, sql-import-wizard",True
How to find which material is assigned to which purchasing group,1532024227,-1,https://stackoverflow.com/questions/51429411/how-to-find-which-material-is-assigned-to-which-purchasing-group,sap-erp,True
How to batch send existing Purchase Orders through a new PO Output Condition?,1531407782,2,https://stackoverflow.com/questions/51308960/how-to-batch-send-existing-purchase-orders-through-a-new-po-output-condition,"edi, sap-erp",False
"Calling MM42, dirty assign of variables in SAPLCTMS for atnam and atwrts - Any experience?",1531401993,1,https://stackoverflow.com/questions/51306921/calling-mm42-dirty-assign-of-variables-in-saplctms-for-atnam-and-atwrts-any-e,"abap, sap-erp",False
XK02 internal error while accessing IXADRU,1530623596,0,https://stackoverflow.com/questions/51155562/xk02-internal-error-while-accessing-ixadru,"abap, sap-erp",False
