title,creation_date,score,link,tags,is_answered
Output type is not defined,1530352065,0,https://stackoverflow.com/questions/51113750/output-type-is-not-defined,"transactions, abap, billing, print-preview, sap-erp",True
How to Push Data into SAP which can create a general Ledger using REST,1529580397,0,https://stackoverflow.com/questions/50967428/how-to-push-data-into-sap-which-can-create-a-general-ledger-using-rest,"java, spring, sap-erp, netweaver, sap-pi",False
Access ABAP CDS View from Cloud HANA DB,1529558882,0,https://stackoverflow.com/questions/50960968/access-abap-cds-view-from-cloud-hana-db,"hana, sap-erp, cds",False
How to build and send an IDOC from MII to SAP ECC using IDOC_Asynchronous_Inbound,1528986435,0,https://stackoverflow.com/questions/50859837/how-to-build-and-send-an-idoc-from-mii-to-sap-ecc-using-idoc-asynchronous-inboun,"integration, sap-erp, idoc",False
Getting all the line items in MIR7,1528883845,0,https://stackoverflow.com/questions/50834339/getting-all-the-line-items-in-mir7,"abap, sap-erp",False
WSO2 SAP Adapter : Unable to send tables data in BAPI RFC call,1528181620,0,https://stackoverflow.com/questions/50693835/wso2-sap-adapter-unable-to-send-tables-data-in-bapi-rfc-call,"wso2, wso2-esb, sap-erp, saprfc, bapi",False
how to execute an interface on SAP EM Data Browser,1528135683,1,https://stackoverflow.com/questions/50686408/how-to-execute-an-interface-on-sap-em-data-browser,"sap-erp, sap-basis",False
SAP PI RFC to REST communication without mapping. Possible?,1527612151,1,https://stackoverflow.com/questions/50589213/sap-pi-rfc-to-rest-communication-without-mapping-possible,"rest, mapping, sap-erp, sap-pi, sap-xi",True
Left outer join does not select all equipment notifs,1527587482,1,https://stackoverflow.com/questions/50581333/left-outer-join-does-not-select-all-equipment-notifs,"abap, opensql, sap-erp",True
BAPI_ALM_ORDER_MAINTAIN not working intermittently,1526992801,0,https://stackoverflow.com/questions/50467981/bapi-alm-order-maintain-not-working-intermittently,"abap, bapi, sap-erp",False
How to create work order and assign notification through BAPI?,1526452626,1,https://stackoverflow.com/questions/50363943/how-to-create-work-order-and-assign-notification-through-bapi,"abap, bapi, sap-erp",False
How can I link RSEG table into BSEG or RBKP to BSEG?,1526375649,1,https://stackoverflow.com/questions/50346420/how-can-i-link-rseg-table-into-bseg-or-rbkp-to-bseg,"abap, sap-erp",True
Getting notifications for functional location,1525757864,0,https://stackoverflow.com/questions/50226532/getting-notifications-for-functional-location,sap-erp,True
Linking equipment (EQUI) To Document information table (DRAW),1525755984,0,https://stackoverflow.com/questions/50226182/linking-equipment-equi-to-document-information-table-draw,sap-erp,True
Suppress Purchase Requisition quantity check,1525698174,1,https://stackoverflow.com/questions/50214922/suppress-purchase-requisition-quantity-check,"debugging, abap, sap-erp, purchase-order",False
Goods Receipts creation issue,1524661218,0,https://stackoverflow.com/questions/50023061/goods-receipts-creation-issue,"abap, sap-erp",True
"Middleware for ERPs like SAP, Netsuite, Microsoft Dynamics",1523868894,-2,https://stackoverflow.com/questions/49853250/middleware-for-erps-like-sap-netsuite-microsoft-dynamics,"netsuite, middleware, microsoft-dynamics, erp, sap-erp",False
Creation of products in Hybris commerce using web services in SAP Data Services,1523339703,0,https://stackoverflow.com/questions/49746286/creation-of-products-in-hybris-commerce-using-web-services-in-sap-data-services,"sap-commerce-cloud, sap-erp, sap-data-services",True
Get profit center/cost center from RBKP invoice receipt number,1523322159,0,https://stackoverflow.com/questions/49743731/get-profit-center-cost-center-from-rbkp-invoice-receipt-number,"abap, sap-erp",True
Add required field to VA02 for certain document types via User Exit,1522947496,0,https://stackoverflow.com/questions/49677736/add-required-field-to-va02-for-certain-document-types-via-user-exit,"abap, sap-erp",False
Instructions on how to install IDES in a laptop,1522913905,-2,https://stackoverflow.com/questions/49666737/instructions-on-how-to-install-ides-in-a-laptop,sap-erp,False
SAP SSL handshake failed,1522764380,1,https://stackoverflow.com/questions/49632169/sap-ssl-handshake-failed,"sap-erp, saprfc, sap-basis, netweaver",True
How to assign notification to work order through BAPI?,1522759114,0,https://stackoverflow.com/questions/49630305/how-to-assign-notification-to-work-order-through-bapi,"abap, bapi, sap-erp",True
Read the dataset in SQL and determine the value,1521140152,0,https://stackoverflow.com/questions/49307238/read-the-dataset-in-sql-and-determine-the-value,"sql, dataset, hana, sap-erp",False
How to get long texts of FI held documents?,1520992631,1,https://stackoverflow.com/questions/49268639/how-to-get-long-texts-of-fi-held-documents,"abap, sap-erp",False
SAP VL02N &#39;Copy Pack Quantities As Dlv. Quantities&#39; FM,1518692199,0,https://stackoverflow.com/questions/48805545/sap-vl02n-copy-pack-quantities-as-dlv-quantities-fm,"abap, function-module, sap-erp",False
Shipment number XXX is currently being processed,1518605137,0,https://stackoverflow.com/questions/48785227/shipment-number-xxx-is-currently-being-processed,"abap, sap-erp",False
Catch a SOAP message send by SAP in a Apex Class,1517923162,0,https://stackoverflow.com/questions/48644034/catch-a-soap-message-send-by-sap-in-a-apex-class,"soap, salesforce, wsdl, apex, sap-erp",True
What things (language...) I have to know if I want to work with SAP ERP,1515988342,-2,https://stackoverflow.com/questions/48256732/what-things-language-i-have-to-know-if-i-want-to-work-with-sap-erp,"system, required, sap-erp",True
SQL Server error - error code 0xC0208449 while running package,1515923429,3,https://stackoverflow.com/questions/48248381/sql-server-error-error-code-0xc0208449-while-running-package,"sql-server, ssis, etl, ssis-2012, sap-erp",False
C# Excel VSTO Execute SAP RFC,1515483271,0,https://stackoverflow.com/questions/48163322/c-excel-vsto-execute-sap-rfc,"c#, vsto, sap-erp, saprfc",False
Which BAdI/user-exit triggers for tax code MWSKZ?,1515405925,3,https://stackoverflow.com/questions/48148012/which-badi-user-exit-triggers-for-tax-code-mwskz,"abap, sap-erp, badi",True
SSIS/SSMS Connection to SAP Reports/Transactions,1514546191,2,https://stackoverflow.com/questions/48021761/ssis-ssms-connection-to-sap-reports-transactions,"ssis, ssms, etl, sap-erp",True
BAPI_CUSTOMER_FIND parameter RESULT_TAB has strange structure,1513850840,1,https://stackoverflow.com/questions/47922498/bapi-customer-find-parameter-result-tab-has-strange-structure,"c#, sap-erp, bapi, sap-dotnet-connector",True
How to run sap r/3 transactions through JCO3? or execute reports through JCO?,1513320281,0,https://stackoverflow.com/questions/47827138/how-to-run-sap-r-3-transactions-through-jco3-or-execute-reports-through-jco,"sap-erp, saprfc, sapjco3, sap-r3",True
Calculate TVA amount in Transaction FB01,1513092513,1,https://stackoverflow.com/questions/47776120/calculate-tva-amount-in-transaction-fb01,sap-erp,False
Where each of them used?,1512986855,1,https://stackoverflow.com/questions/47750460/where-each-of-them-used,"sql, hana, sap-erp",True
Difference between AUFK-AUFNR and AUFK-KDAUF,1512677702,2,https://stackoverflow.com/questions/47703058/difference-between-aufk-aufnr-and-aufk-kdauf,sap-erp,True
IF_EX_ME_CD_TRIGGER not exist in ABAP 730,1512576796,-2,https://stackoverflow.com/questions/47678779/if-ex-me-cd-trigger-not-exist-in-abap-730,"abap, sap-erp",True
error-getwa_not_assigned in invoice printing program,1511843252,0,https://stackoverflow.com/questions/47524028/error-getwa-not-assigned-in-invoice-printing-program,"abap, sap-erp",True
C# SapDataReader cmd.ExecuteReader() Error,1511344954,0,https://stackoverflow.com/questions/47431713/c-sapdatareader-cmd-executereader-error,"c#, .net, sap-erp, saprfc",False
BAPI Function Rollback on asp.net web pages,1511240851,1,https://stackoverflow.com/questions/47405606/bapi-function-rollback-on-asp-net-web-pages,"c#, asp.net, abap, bapi, sap-erp",True
Import data from transaction CKIS,1510840172,0,https://stackoverflow.com/questions/47331377/import-data-from-transaction-ckis,"sap-erp, sap-gui",True
Is it possible to use DMEE tree for import and parsing xml file,1510811074,0,https://stackoverflow.com/questions/47322460/is-it-possible-to-use-dmee-tree-for-import-and-parsing-xml-file,"xml, import, xml-parsing, abap, sap-erp",False
Transfer bkpf into tab delimented file in background,1509893493,-5,https://stackoverflow.com/questions/47122906/transfer-bkpf-into-tab-delimented-file-in-background,"abap, jobs, sap-erp",True
Read material text for multiple languages at the same time with READ_TEXT FM,1509613401,0,https://stackoverflow.com/questions/47071244/read-material-text-for-multiple-languages-at-the-same-time-with-read-text-fm,"abap, alv, sap-erp",True
Rounded number issue,1508919554,0,https://stackoverflow.com/questions/46927372/rounded-number-issue,"rounding, hana, sap-erp",False
Customer Master - Contact Person details,1508482479,0,https://stackoverflow.com/questions/46843807/customer-master-contact-person-details,"abap, sap-erp",True
from which table to take base quantity for production orders?,1508243877,-1,https://stackoverflow.com/questions/46790324/from-which-table-to-take-base-quantity-for-production-orders,"abap, sap-erp",True
Making dynamic selections field required,1505825168,-2,https://stackoverflow.com/questions/46300845/making-dynamic-selections-field-required,"abap, sap-erp",True
SAP GUI Client integration with classic ASP ActiveX component can&#39;t create object,1505813871,0,https://stackoverflow.com/questions/46296955/sap-gui-client-integration-with-classic-asp-activex-component-cant-create-objec,"asp-classic, sap-gui, sap-erp",False
Execute IP30(RISTRA20) from report,1505801276,1,https://stackoverflow.com/questions/46293016/execute-ip30ristra20-from-report,"abap, sap-erp",True
I want to store all the change records of ECC table as a separate line item in HANA table,1505632626,2,https://stackoverflow.com/questions/46261623/i-want-to-store-all-the-change-records-of-ecc-table-as-a-separate-line-item-in-h,"hana, sap-erp",False
How to fill advanced return management datas fields during bapi call,1504536876,0,https://stackoverflow.com/questions/46039640/how-to-fill-advanced-return-management-datas-fields-during-bapi-call,"abap, sap-erp",True
A safe way to avoid ABAP program running in productive ERP system,1503318905,2,https://stackoverflow.com/questions/45797292/a-safe-way-to-avoid-abap-program-running-in-productive-erp-system,"abap, sap-erp, sap-basis",True
FM to simulate Delivery without Reference Sales Order,1502201527,1,https://stackoverflow.com/questions/45570693/fm-to-simulate-delivery-without-reference-sales-order,"abap, bapi, sap-erp, function-module",True
BAPI or FM for searching FI documents,1501835494,1,https://stackoverflow.com/questions/45501907/bapi-or-fm-for-searching-fi-documents,"finance, sap-erp, bapi",True
Maintain Cross reference in SAP-MDG,1501743254,1,https://stackoverflow.com/questions/45476926/maintain-cross-reference-in-sap-mdg,"sap-erp, master-data-management",True
How can I return a summation of the results of MB51 instead of the row-by-row transactions?,1501004373,-1,https://stackoverflow.com/questions/45310219/how-can-i-return-a-summation-of-the-results-of-mb51-instead-of-the-row-by-row-tr,sap-erp,True
"In SAP SQ01, how can I avoid an ABAP runtime error due to a returned null value in a local calculated field?",1500628771,-1,https://stackoverflow.com/questions/45233866/in-sap-sq01-how-can-i-avoid-an-abap-runtime-error-due-to-a-returned-null-value,"abap, sap-erp, sap-query",False
Change standard authorization in VF04,1499432641,0,https://stackoverflow.com/questions/44971494/change-standard-authorization-in-vf04,"authorization, abap, sap-erp",False
Update material field of an already created material in Hybris,1499102308,1,https://stackoverflow.com/questions/44891010/update-material-field-of-an-already-created-material-in-hybris,"sap-commerce-cloud, idoc, sap-erp",True
Values not get populated on item level in sap during contract creation,1499076435,0,https://stackoverflow.com/questions/44882873/values-not-get-populated-on-item-level-in-sap-during-contract-creation,"abap, bapi, sap-erp",False
API to import data of SAP ERP project to Smartsheet?,1498048099,0,https://stackoverflow.com/questions/44676149/api-to-import-data-of-sap-erp-project-to-smartsheet,"smartsheet-api, sap-erp",True
The definition of Good Movements,1497856599,-2,https://stackoverflow.com/questions/44624401/the-definition-of-good-movements,sap-erp,True
How to convert internal table of type LISTZEILE into JSON or XML?,1497430631,-1,https://stackoverflow.com/questions/44540065/how-to-convert-internal-table-of-type-listzeile-into-json-or-xml,"json, xml, abap, sap-erp, sap-gateway",False
Calling BAPI_PO_CREATE using SAP.Net Connector 3.0,1497090960,4,https://stackoverflow.com/questions/44472316/calling-bapi-po-create-using-sap-net-connector-3-0,"c#, .net, sap-erp, bapi, sap-dotnet-connector",True
WBS Requested budget and Approved Budget,1496843219,-1,https://stackoverflow.com/questions/44414501/wbs-requested-budget-and-approved-budget,"abap, sap-erp",False
How to add a button in &#39;TERM_CONTROL_EDIT&#39; popup,1495794092,0,https://stackoverflow.com/questions/44199131/how-to-add-a-button-in-term-control-edit-popup,"button, popup, abap, sap-erp, dynpro",True
How to connect SAP ERP 6.0 to SQL Server 2014,1495438222,1,https://stackoverflow.com/questions/44107088/how-to-connect-sap-erp-6-0-to-sql-server-2014,"sql-server, sql-server-express, sap-erp",False
How to access an OnPremise system from AWS using Node.JS,1495049523,1,https://stackoverflow.com/questions/44033330/how-to-access-an-onpremise-system-from-aws-using-node-js,"node.js, amazon-web-services, sap-erp, hybrid-cloud, sap-cloud-connector",True
problems with &#39;RV_INVOICE_DOCUMENT_READ&#39;,1494966814,0,https://stackoverflow.com/questions/44011073/problems-with-rv-invoice-document-read,"abap, sap-erp",True
BAPI for adding descriptions to Master Changes?,1493784977,0,https://stackoverflow.com/questions/43750961/bapi-for-adding-descriptions-to-master-changes,"abap, bapi, sap-erp",True
How to configure OCI catalog for ME51N?,1493324114,1,https://stackoverflow.com/questions/43667149/how-to-configure-oci-catalog-for-me51n,"abap, sap-erp, badi",False
Data seems not updated between Update and Read despite commit,1493276739,2,https://stackoverflow.com/questions/43650832/data-seems-not-updated-between-update-and-read-despite-commit,"abap, sap-erp",True
Import and use authenticated SAP WSDLs with Eclipse/Maven,1493215888,0,https://stackoverflow.com/questions/43636671/import-and-use-authenticated-sap-wsdls-with-eclipse-maven,"eclipse, maven, soap, wsdl, sap-erp",False
Central mass archiving change for business partners,1491980463,0,https://stackoverflow.com/questions/43362528/central-mass-archiving-change-for-business-partners,"abap, jobs, sap-erp",True
Is it a good idea to have a database of Photos within SAP ECC,1489407923,2,https://stackoverflow.com/questions/42763612/is-it-a-good-idea-to-have-a-database-of-photos-within-sap-ecc,"sapui5, sap-erp",True
How can I test my integration with SAP for free?,1488623424,-2,https://stackoverflow.com/questions/42594914/how-can-i-test-my-integration-with-sap-for-free,"sap-erp, sap-dotnet-connector, netweaver",True
Extracting Purchase Order texts in SAP,1487239196,1,https://stackoverflow.com/questions/42270566/extracting-purchase-order-texts-in-sap,"abap, sap-erp",True
Formats supported by SAP PI for non-SAP to SAP integration,1486664252,0,https://stackoverflow.com/questions/42144079/formats-supported-by-sap-pi-for-non-sap-to-sap-integration,"integration, sap-erp, sap-pi, sap-xi",True
Service interface is not visible in SPROXY,1486481954,0,https://stackoverflow.com/questions/42093910/service-interface-is-not-visible-in-sproxy,"web-services, abap, sap-erp, sap-pi, sap-xi",False
linking between tables in abap data dictionary,1485960392,0,https://stackoverflow.com/questions/41982573/linking-between-tables-in-abap-data-dictionary,sap-erp,True
Creation of N deliveries from N Sales Orders in one BAPI_OUTB_DELIVERY_CREATE_SLS call?,1485938632,0,https://stackoverflow.com/questions/41975309/creation-of-n-deliveries-from-n-sales-orders-in-one-bapi-outb-delivery-create-sl,"sap-erp, bapi",False
Hybris SAP CPQ getting sample data,1485769501,0,https://stackoverflow.com/questions/41932804/hybris-sap-cpq-getting-sample-data,"mocking, sap-commerce-cloud, sap-erp",True
Transaction per user historical report?,1485585338,2,https://stackoverflow.com/questions/41907072/transaction-per-user-historical-report,"sap-erp, sap-basis",True
DataStage SAP BAPI_ALM_ORDER_MAINTAIN,1485427432,0,https://stackoverflow.com/questions/41871705/datastage-sap-bapi-alm-order-maintain,"datastage, sap-erp, bapi",False
Trigger code after passing all checks in MM01 but before DB commit?,1484916340,1,https://stackoverflow.com/questions/41764037/trigger-code-after-passing-all-checks-in-mm01-but-before-db-commit,sap-erp,False
how to set PIKMG in delivery to 0?,1484737815,-1,https://stackoverflow.com/questions/41717869/how-to-set-pikmg-in-delivery-to-0,"sap-erp, bapi",False
Function Module to copy purchase order to another order,1484676560,0,https://stackoverflow.com/questions/41704099/function-module-to-copy-purchase-order-to-another-order,"bapi, sap-erp",True
SAP GUIXT - Pass Variable and run script,1484538511,1,https://stackoverflow.com/questions/41669159/sap-guixt-pass-variable-and-run-script,"vbscript, sap-erp, sap-gui",True
SAP integration with Xamarin?,1484125941,3,https://stackoverflow.com/questions/41586727/sap-integration-with-xamarin,".net, xamarin, sap-erp, saprfc",True
How can a WebApp integrate with ERP-systems of dozens of firms?,1483562298,-1,https://stackoverflow.com/questions/41472818/how-can-a-webapp-integrate-with-erp-systems-of-dozens-of-firms,"oracle-database, middleware, marketplace, sap-erp",True
BOM is not exploded when called via BAPI_SALESORDER_CREATEFROMDAT2,1483562056,0,https://stackoverflow.com/questions/41472755/bom-is-not-exploded-when-called-via-bapi-salesorder-createfromdat2,"abap, bapi, sap-erp",False
Java Spring MVC application integrated with SAP ERP,1483447104,1,https://stackoverflow.com/questions/41443739/java-spring-mvc-application-integrated-with-sap-erp,"java, integration, sap-erp, jco",False
How to remove serial numbers from delivery SAP?,1482400615,0,https://stackoverflow.com/questions/41280335/how-to-remove-serial-numbers-from-delivery-sap,"sap-erp, bapi, function-module",False
sap - abap &#39;sd_salesdocument_create&#39;,1482397963,0,https://stackoverflow.com/questions/41279467/sap-abap-sd-salesdocument-create,"abap, sap-erp",False
Move data from an external system into Teradata database,1481877855,1,https://stackoverflow.com/questions/41180346/move-data-from-an-external-system-into-teradata-database,"odata, etl, teradata, sap-erp, sap-gateway",False
How to configure a variant for a material in MRP3 view using BAPI?,1481819889,1,https://stackoverflow.com/questions/41169123/how-to-configure-a-variant-for-a-material-in-mrp3-view-using-bapi,"sap-erp, bapi",True
Enable for input erroneous field after the E error message in MIRO?,1481414105,1,https://stackoverflow.com/questions/41081575/enable-for-input-erroneous-field-after-the-e-error-message-in-miro,"abap, sap-erp, dynpro, badi",True
Connect to SAP through C# application,1481096735,3,https://stackoverflow.com/questions/41011913/connect-to-sap-through-c-application,"c#, asp.net, oracle-database, ado.net, sap-erp",True
How to download automatically specific files from SAP with powershell,1481024651,0,https://stackoverflow.com/questions/40994567/how-to-download-automatically-specific-files-from-sap-with-powershell,"powershell, report, sap-gui, sap-erp",False
SAP BMBC Transaction - Detail Function is disabled and cannot switch between Batch Master and Usage,1481020350,0,https://stackoverflow.com/questions/40993170/sap-bmbc-transaction-detail-function-is-disabled-and-cannot-switch-between-bat,sap-erp,True
Unable to delete material object in change record- CC02,1480679844,0,https://stackoverflow.com/questions/40931702/unable-to-delete-material-object-in-change-record-cc02,sap-erp,False
Which tables &quot;Partner functions&quot; information stored in SAP ERP database?,1480540986,-1,https://stackoverflow.com/questions/40898452/which-tables-partner-functions-information-stored-in-sap-erp-database,sap-erp,True
CASE statement syntax error in SAP Lumira / Freehand SQL,1480494932,1,https://stackoverflow.com/questions/40883635/case-statement-syntax-error-in-sap-lumira-freehand-sql,"sql, case-statement, sap-erp, sap-lumira",False
ABAP SAPMV45A Additional Fields Tabs,1479897906,1,https://stackoverflow.com/questions/40762240/abap-sapmv45a-additional-fields-tabs,"abap, sap-erp, dynpro",True
How to suppress dialog boxes coming from submitted program,1479306027,0,https://stackoverflow.com/questions/40634497/how-to-suppress-dialog-boxes-coming-from-submitted-program,"abap, sap-erp",True
Error &quot;Server default repository destination XXXX is invalid&quot; when running application JAR,1478908693,1,https://stackoverflow.com/questions/40558057/error-server-default-repository-destination-xxxx-is-invalid-when-running-appli,"java, jar, sap-erp, idoc, sapjco3",True
BAPI_PO_CREATE1 Account 475000 requires an assignment to a CO object,1478075864,0,https://stackoverflow.com/questions/40375493/bapi-po-create1-account-475000-requires-an-assignment-to-a-co-object,"abap, bapi, sap-erp",False
Check SAP Netweaver and ABAP Version Information,1477408358,0,https://stackoverflow.com/questions/40243603/check-sap-netweaver-and-abap-version-information,"abap, netweaver, sap-erp",True
How to send/check the status of an IDoc sent to SAP ECC through ALE Audit?,1477082183,0,https://stackoverflow.com/questions/40185063/how-to-send-check-the-status-of-an-idoc-sent-to-sap-ecc-through-ale-audit,"sap-erp, idoc, sapjco3",False
SAP FIORI Media list to download from SMP,1474963268,0,https://stackoverflow.com/questions/39719267/sap-fiori-media-list-to-download-from-smp,"sap-fiori, sap-erp",False
ALV List Viewer for single entry in IW29/39 transaction,1474633227,1,https://stackoverflow.com/questions/39660641/alv-list-viewer-for-single-entry-in-iw29-39-transaction,"vba, list, transactions, sap-erp, sap-gui",True
IN OR multiple operator SAP Java,1472067612,1,https://stackoverflow.com/questions/39131785/in-or-multiple-operator-sap-java,"java, sap-erp, jco",True
Get Quality notification attachments,1472044054,2,https://stackoverflow.com/questions/39124220/get-quality-notification-attachments,"attachment, abap, bapi, sap-erp",False
how to call bapi in se37 and give output of bapi to another bapi,1471417081,0,https://stackoverflow.com/questions/38990023/how-to-call-bapi-in-se37-and-give-output-of-bapi-to-another-bapi,"uri, abap, bapi, sap-erp, sap-gateway",False
Changing average price in Material Master (MM02) programmatically,1471269520,1,https://stackoverflow.com/questions/38956494/changing-average-price-in-material-master-mm02-programmatically,"abap, bapi, sap-erp, function-module",True
Get Quality Notification SAP - BAPI_QUALNOT_GETDETAIL,1469552874,0,https://stackoverflow.com/questions/38596014/get-quality-notification-sap-bapi-qualnot-getdetail,"abap, sap-erp",True
File Download with SAP .NET Connector,1469544699,1,https://stackoverflow.com/questions/38593225/file-download-with-sap-net-connector,".net, sap-erp, sap-dotnet-connector",True
Reset Cache of Basis CHIPs (/UI2/CHIP_CSTAT) is locked by user xxxx in Activating &quot;Manage Purchase Orders&quot;,1468563746,0,https://stackoverflow.com/questions/38389131/reset-cache-of-basis-chips-ui2-chip-cstat-is-locked-by-user-xxxx-in-activatin,"sap-fiori, sap-erp, sap-basis",False
Identify VKORG field (Sales organization) in a sales order or invoice,1468359751,0,https://stackoverflow.com/questions/38339339/identify-vkorg-field-sales-organization-in-a-sales-order-or-invoice,"abap, sap-erp, sap-r3",True
Paste entire column from excel to SAP ECC table,1468267626,0,https://stackoverflow.com/questions/38315330/paste-entire-column-from-excel-to-sap-ecc-table,"excel, copy-paste, sap-erp",False
Get GOS attachment list for notification via BAPI,1466756460,3,https://stackoverflow.com/questions/38008762/get-gos-attachment-list-for-notification-via-bapi,"abap, sap-erp, bapi, function-module",True
Is there BAPI equivalent to transaction CKMM?,1465922895,2,https://stackoverflow.com/questions/37817851/is-there-bapi-equivalent-to-transaction-ckmm,"abap, sap-erp, bapi",True
Identify where-used table for a field of SAP ERP transaction,1464738562,0,https://stackoverflow.com/questions/37557365/identify-where-used-table-for-a-field-of-sap-erp-transaction,sap-erp,True
Opening af file in EasyDMS with Excel VBA,1464288976,0,https://stackoverflow.com/questions/37468971/opening-af-file-in-easydms-with-excel-vba,"excel, vba, sap-erp",False
Mass Upload of Freight Agreement in SAP TM,1463752234,1,https://stackoverflow.com/questions/37348444/mass-upload-of-freight-agreement-in-sap-tm,"sap-erp, bapi",False
BAPI Function Get list of customer sort by date DESC,1462991807,0,https://stackoverflow.com/questions/37170806/bapi-function-get-list-of-customer-sort-by-date-desc,"java, abap, jco, bapi, sap-erp",True
Business Suite vs S/4HANA,1462978725,0,https://stackoverflow.com/questions/37166433/business-suite-vs-s-4hana,"sap-erp, s4hana, sap-crm",False
How to update delivery quantity via BAPI?,1462364576,1,https://stackoverflow.com/questions/37027720/how-to-update-delivery-quantity-via-bapi,"abap, bapi, sap-erp",True
