title,creation_date,score,link,tags,is_answered
Http keep-alive protocol &quot;Connection: close&quot; from client but no &quot;connection&quot; header from server,1459417834,1,https://stackoverflow.com/questions/36329903/http-keep-alive-protocol-connection-close-from-client-but-no-connection-hea,"java, http, odata, keep-alive, sap-erp",False
FM updating Installation type in EANL table returns SY-SUBRC = 0 even if it fails,1458484100,0,https://stackoverflow.com/questions/36114951/fm-updating-installation-type-in-eanl-table-returns-sy-subrc-0-even-if-it-fail,"abap, sap-erp",True
How to integrate php application with SAP using web service?,1457504460,-2,https://stackoverflow.com/questions/35884399/how-to-integrate-php-application-with-sap-using-web-service,"php, integration, sap-erp",False
"One RFC call is returning data, but another is not",1457455199,2,https://stackoverflow.com/questions/35872964/one-rfc-call-is-returning-data-but-another-is-not,"c#, sap-erp, sap-dotnet-connector",True
Get SAP BAPI Table (not Exporting) after processing - Using SAP .NET Connector 3.0,1457040174,0,https://stackoverflow.com/questions/35783307/get-sap-bapi-table-not-exporting-after-processing-using-sap-net-connector-3,"c#, sap-erp, bapi, sap-dotnet-connector",True
How do I send the needed parameters to REFDOCRANGE using NSAPConnector?,1457015676,1,https://stackoverflow.com/questions/35775038/how-do-i-send-the-needed-parameters-to-refdocrange-using-nsapconnector,"c#, sap-erp, bapi, sap-dotnet-connector",True
Incorrect LC2 amount in transaction code MM03,1457013904,-1,https://stackoverflow.com/questions/35774345/incorrect-lc2-amount-in-transaction-code-mm03,sap-erp,True
Changing implementation of SAP Note 303453 - User exits for shipping data determination in STO,1456844348,0,https://stackoverflow.com/questions/35726212/changing-implementation-of-sap-note-303453-user-exits-for-shipping-data-determ,"abap, sap-erp, sap-basis",False
How to get a range of serial numbers based on the movement type?,1454511361,0,https://stackoverflow.com/questions/35180346/how-to-get-a-range-of-serial-numbers-based-on-the-movement-type,"serialization, sap-erp",False
Where can I find the SAP configuration properties?,1454321961,0,https://stackoverflow.com/questions/35128003/where-can-i-find-the-sap-configuration-properties,sap-erp,True
Transaction VOV4 how to maintain table key field? (input disabled),1453913126,0,https://stackoverflow.com/questions/35043209/transaction-vov4-how-to-maintain-table-key-field-input-disabled,sap-erp,True
Microsoft.Adapters.SAP properties not listed in the filters section when creating a send port,1452716748,0,https://stackoverflow.com/questions/34776378/microsoft-adapters-sap-properties-not-listed-in-the-filters-section-when-creatin,"biztalk, sap-erp, sap-basis, biztalk-2013r2",True
Material Ledger consistency check function module,1451311407,1,https://stackoverflow.com/questions/34494991/material-ledger-consistency-check-function-module,"abap, sap-erp, bapi",True
Can Single Sign On (SAML) be used to integrate SAP&#39;s ERP with Google for Work?,1450279670,-2,https://stackoverflow.com/questions/34315887/can-single-sign-on-saml-be-used-to-integrate-saps-erp-with-google-for-work,"saml, saml-2.0, google-apps, sap-erp",False
CALL TRANSACTION MR11 does not fill error table,1449585486,0,https://stackoverflow.com/questions/34158626/call-transaction-mr11-does-not-fill-error-table,"error-handling, ui-automation, abap, sap-erp",True
How to get Purchase Order and Status from SAP,1449033246,0,https://stackoverflow.com/questions/34035398/how-to-get-purchase-order-and-status-from-sap,".net, asp.net-mvc, sap-erp, sap-dotnet-connector",False
Create a transfer order with an Empty Vendor number,1448451713,1,https://stackoverflow.com/questions/33915614/create-a-transfer-order-with-an-empty-vendor-number,"abap, sap-erp, warehouse",False
Remove BOPF Message (from /bobf/if_frw_message) via ABAP,1448371184,0,https://stackoverflow.com/questions/33894785/remove-bopf-message-from-bobf-if-frw-message-via-abap,"error-handling, message, abap, sap-erp",True
Disable Column in VA01,1448281758,1,https://stackoverflow.com/questions/33871139/disable-column-in-va01,"abap, sap-erp, dynpro",True
Update BSEG-ZUONR with Function Module,1447918744,1,https://stackoverflow.com/questions/33797804/update-bseg-zuonr-with-function-module,"abap, sap-erp, bapi",True
Intel Gallileo or Arduino Yun?,1446756500,0,https://stackoverflow.com/questions/33554497/intel-gallileo-or-arduino-yun,"intel, sap-erp, sap-business-technology-platform, intel-galileo, arduino-yun",False
"SAPUI5: SAP-Server sends no-cache, Appcache doesn&#39;t work",1446195087,1,https://stackoverflow.com/questions/33431963/sapui5-sap-server-sends-no-cache-appcache-doesnt-work,"sapui5, html5-appcache, sap-erp, netweaver, sap-bsp",False
Indication that the sales order has been goods issued,1445869220,0,https://stackoverflow.com/questions/33348075/indication-that-the-sales-order-has-been-goods-issued,"abap, sap-erp",False
Insert Person/Employee into organizational unit programmatically (like PPOME)?,1445863773,0,https://stackoverflow.com/questions/33346192/insert-person-employee-into-organizational-unit-programmatically-like-ppome,"abap, sap-erp",True
IF sy-tcode = &#39;MB1B&#39; statement being subtly ignored in selection,1445613934,1,https://stackoverflow.com/questions/33306083/if-sy-tcode-mb1b-statement-being-subtly-ignored-in-selection,"abap, sap-erp",True
BAPI or FM equal to transaction KE24,1444919436,0,https://stackoverflow.com/questions/33151258/bapi-or-fm-equal-to-transaction-ke24,"c#, sap-erp, bapi",True
Detailed error messages for SAP function module CSAP_MAT_BOM_CREATE,1444824095,-1,https://stackoverflow.com/questions/33124731/detailed-error-messages-for-sap-function-module-csap-mat-bom-create,"abap, sap-erp",True
Tableau Desktop on SAP ECC,1444758182,0,https://stackoverflow.com/questions/33109211/tableau-desktop-on-sap-ecc,"tableau-api, sap-erp",False
User exit for production order confirmation in CO11N?,1443210313,2,https://stackoverflow.com/questions/32789567/user-exit-for-production-order-confirmation-in-co11n,"abap, sap-erp, badi",True
SAP Business Object in Open Text Content Server,1443026094,0,https://stackoverflow.com/questions/32744921/sap-business-object-in-open-text-content-server,"sap-erp, opentext",True
User-Exit EXIT_SAPMM07M_003 is not triggered,1442586945,0,https://stackoverflow.com/questions/32654643/user-exit-exit-sapmm07m-003-is-not-triggered,"include, hook, abap, sap-erp",True
Load xls with cell values of 80+ characters from frontend,1441878805,1,https://stackoverflow.com/questions/32498565/load-xls-with-cell-values-of-80-characters-from-frontend,"abap, xls, sap-erp",True
How to upload document and connect it to a SAP customer?,1441612779,1,https://stackoverflow.com/questions/32433749/how-to-upload-document-and-connect-it-to-a-sap-customer,"abap, sap-erp",True
How to use JCo connection without creating *.JcoDestination file,1441369635,3,https://stackoverflow.com/questions/32398065/how-to-use-jco-connection-without-creating-jcodestination-file,"java, jakarta-ee, sap-erp, jco, bapi",True
Is the SAP GUI scripting API dependent on backend SAP database?,1441164451,0,https://stackoverflow.com/questions/32344186/is-the-sap-gui-scripting-api-dependent-on-backend-sap-database,"scripting, hana, sap-erp",True
Unable to create Sales Order from JCO,1440584289,0,https://stackoverflow.com/questions/32223907/unable-to-create-sales-order-from-jco,"sap-erp, bapi, jco",True
trying to find a way to familiarize myself with the structure and content of the database that sits behind a SAP PLM,1440518686,1,https://stackoverflow.com/questions/32208841/trying-to-find-a-way-to-familiarize-myself-with-the-structure-and-content-of-the,"database, abap, sap-erp",True
"Using ERP Movement type data, how to check if a certain sequence of cells is in correct order?",1440513254,0,https://stackoverflow.com/questions/32206888/using-erp-movement-type-data-how-to-check-if-a-certain-sequence-of-cells-is-in,"excel, vba, excel-formula, sap-erp",False
how to create a purchase order using BAPI : BAPI_PO_CREATE1,1440139394,-1,https://stackoverflow.com/questions/32133970/how-to-create-a-purchase-order-using-bapi-bapi-po-create1,"sap-erp, jco",False
Error while creating sales order using JCO with BAPI_SALESORDER_CREATEFROMDAT2,1440136027,0,https://stackoverflow.com/questions/32133170/error-while-creating-sales-order-using-jco-with-bapi-salesorder-createfromdat2,"sap-erp, bapi",True
Runtime Error CONVT_NO_NUMBER in program SAPLMEPO (ME21n),1438834120,2,https://stackoverflow.com/questions/31846687/runtime-error-convt-no-number-in-program-saplmepo-me21n,"abap, sap-erp",True
How to attach files in MIRO,1438142747,0,https://stackoverflow.com/questions/31691052/how-to-attach-files-in-miro,"abap, sap-erp",False
SAP get Sales Orders BAPISDORDER_GETDETAILEDLIST,1437378193,0,https://stackoverflow.com/questions/31511158/sap-get-sales-orders-bapisdorder-getdetailedlist,"c#, sap-erp, saprfc, bapi",True
Pentaho Kettle Connect to SAP,1436891134,0,https://stackoverflow.com/questions/31412236/pentaho-kettle-connect-to-sap,"pentaho, kettle, sap-erp",True
Export billing documents to Excel,1435741138,0,https://stackoverflow.com/questions/31156898/export-billing-documents-to-excel,"excel, sap-erp",False
SAP connection to extract data from PHP,1435330655,0,https://stackoverflow.com/questions/31076348/sap-connection-to-extract-data-from-php,"php, sap-erp, sap-dotnet-connector",True
Error while reversing document in SAP using BAPI,1435054109,0,https://stackoverflow.com/questions/30999857/error-while-reversing-document-in-sap-using-bapi,".net, sap-erp, bapi",False
How to execute a BADI in BAPI_ACC_DOCUMENT_POST from C#?,1433927478,1,https://stackoverflow.com/questions/30751996/how-to-execute-a-badi-in-bapi-acc-document-post-from-c,"sap-erp, bapi, sap-dotnet-connector, badi",False
second and third line item is NOT updating using `bapi_salesorder_change`,1433914904,0,https://stackoverflow.com/questions/30747954/second-and-third-line-item-is-not-updating-using-bapi-salesorder-change,"abap, sap-erp",False
How do SAP and Navision interact with third-party applications?,1432981782,0,https://stackoverflow.com/questions/30545004/how-do-sap-and-navision-interact-with-third-party-applications,"sap-erp, microsoft-dynamics-nav, sap-crm",True
SAP Connecting with Windows using Biz talk Adapter The specified module could not be found. (Exception from HRESULT: 0x8007007E),1432205505,0,https://stackoverflow.com/questions/30371610/sap-connecting-with-windows-using-biz-talk-adapter-the-specified-module-could-no,"biztalk, sap-erp",False
Invalid byte 2 of 2-byte UTF-8 sequence in SAP PI mapping,1432196520,0,https://stackoverflow.com/questions/30368265/invalid-byte-2-of-2-byte-utf-8-sequence-in-sap-pi-mapping,"xml, utf-8, sap-erp, sap-pi, sap-xi",True
SAP FB03 with custom item selection,1431971400,0,https://stackoverflow.com/questions/30309808/sap-fb03-with-custom-item-selection,"document, abap, sap-erp",True
&quot;Update Terminated&quot; on /nva01 transaction,1431412277,0,https://stackoverflow.com/questions/30183403/update-terminated-on-nva01-transaction,"abap, sap-erp",True
Find out detailed information about X.509 certificate the ERP user logged on with,1430210101,0,https://stackoverflow.com/questions/29914316/find-out-detailed-information-about-x-509-certificate-the-erp-user-logged-on-wit,"certificate, abap, soa, x509, sap-erp",False
Plant data is not passing in MM02,1430133958,0,https://stackoverflow.com/questions/29894428/plant-data-is-not-passing-in-mm02,"hook, abap, sap-erp",False
SAP MD04 - Overview Tree Export,1429621230,-1,https://stackoverflow.com/questions/29772968/sap-md04-overview-tree-export,sap-erp,True
Error Configuring Oracle Database during SAP ERP installation,1429321231,0,https://stackoverflow.com/questions/29711950/error-configuring-oracle-database-during-sap-erp-installation,"oracle-database, oracle10g, sap-erp",False
SAP: Can&#180;t create and activate a costcenter via BAPI_COSTCENTER_CREATEMULTIPLE,1428912469,-1,https://stackoverflow.com/questions/29600632/sap-can%c2%b4t-create-and-activate-a-costcenter-via-bapi-costcenter-createmultiple,"abap, bapi, sap-erp",True
Accessing SAP Pool Table A016 from Sql Developer,1427307675,1,https://stackoverflow.com/questions/29263510/accessing-sap-pool-table-a016-from-sql-developer,"oracle-database, oracle11g, sap-erp, sap-data-dictionary",True
VBS to export data out of SAP transaction code FBL5N,1426694316,0,https://stackoverflow.com/questions/29126808/vbs-to-export-data-out-of-sap-transaction-code-fbl5n,"vbscript, sap-gui, sap-erp",True
VBA: import joined SAP data to Excel via RFC,1426514195,0,https://stackoverflow.com/questions/29078596/vba-import-joined-sap-data-to-excel-via-rfc,"excel, vba, import, sap-erp, saprfc",True
error while confirming production order (CO15),1426373603,0,https://stackoverflow.com/questions/29055199/error-while-confirming-production-order-co15,sap-erp,False
How to delete component of BOM (bill of material) in SAP,1426299952,0,https://stackoverflow.com/questions/29044771/how-to-delete-component-of-bom-bill-of-material-in-sap,sap-erp,True
`BAPI_PO_RELEASE` not returning success in sap,1424955890,0,https://stackoverflow.com/questions/28743261/bapi-po-release-not-returning-success-in-sap,"abap, sap-erp",True
Different table names in different databases?,1424942153,0,https://stackoverflow.com/questions/28738399/different-table-names-in-different-databases,"database, opensql, sap-erp, sap-data-dictionary",True
Avoid creation of objects through SAP GUI,1424334752,0,https://stackoverflow.com/questions/28601660/avoid-creation-of-objects-through-sap-gui,"abap, sap-erp, sap-hr",False
Abap change pointers send complete material master data idoc,1423584043,0,https://stackoverflow.com/questions/28436149/abap-change-pointers-send-complete-material-master-data-idoc,"abap, sap-erp, idoc",True
Send a text in message body and not as an attachment,1422454620,0,https://stackoverflow.com/questions/28194475/send-a-text-in-message-body-and-not-as-an-attachment,"email, outlook, exchange-server, abap, sap-erp",True
PHP SOAP Request via SOAPClient to SAP - params missing error,1421777778,0,https://stackoverflow.com/questions/28052403/php-soap-request-via-soapclient-to-sap-params-missing-error,"php, soap, sap-erp",False
Updating STCEG error in cmd_ei_api=&gt;maintain_bapi,1421624411,0,https://stackoverflow.com/questions/28016098/updating-stceg-error-in-cmd-ei-api-maintain-bapi,"abap, sap-erp",True
version 0 is not defined for fiscal year xxxx error message,1421296378,-1,https://stackoverflow.com/questions/27956847/version-0-is-not-defined-for-fiscal-year-xxxx-error-message,sap-erp,True
Difference between BAPI_ACC_GL_POSTING_POST and BAPI_ACC_DOCUMENT_POST?,1418837266,0,https://stackoverflow.com/questions/27531365/difference-between-bapi-acc-gl-posting-post-and-bapi-acc-document-post,"abap, sap-erp, bapi",True
BAPI_MATERIAL_SAVEREPLICA throws &quot;no update (test mode)&quot;,1417107612,0,https://stackoverflow.com/questions/27175746/bapi-material-savereplica-throws-no-update-test-mode,"c#, abap, sap-erp, bapi, sap-dotnet-connector",True
BAPI_MATERIAL_GET_DETAIL cannot fetch MATERIALVALUATIONDATA,1415697538,0,https://stackoverflow.com/questions/26861366/bapi-material-get-detail-cannot-fetch-materialvaluationdata,"sap-erp, bapi, jco",True
SE37 CSAP_MAT_BOM_READ runtime error during CONVERT_MATNR_TO_INTERN_FORMAT,1415623321,1,https://stackoverflow.com/questions/26844107/se37-csap-mat-bom-read-runtime-error-during-convert-matnr-to-intern-format,"abap, sap-erp",True
In SAP how can I get the real IP address of a user connecting via VPN,1415126258,0,https://stackoverflow.com/questions/26742526/in-sap-how-can-i-get-the-real-ip-address-of-a-user-connecting-via-vpn,"ip-address, vpn, sap-gui, sap-erp",False
SAP .NET Connector 3.0: Sales Order changes,1414842432,1,https://stackoverflow.com/questions/26688992/sap-net-connector-3-0-sales-order-changes,"c#, sap-erp, saprfc, sap-dotnet-connector",True
Read detailed variant configuration from sales order,1414661343,0,https://stackoverflow.com/questions/26649280/read-detailed-variant-configuration-from-sales-order,"abap, sap-erp",True
BizTalk 2009. WCF-SAP. Error receiving IDOC&#39;s from SAP R/3,1414651481,0,https://stackoverflow.com/questions/26646652/biztalk-2009-wcf-sap-error-receiving-idocs-from-sap-r-3,"biztalk, biztalk-2009, sap-erp, sap-r3",False
User input in Z fields is not processed in CUSTOMER_ADD_DATA BAdI,1414487945,1,https://stackoverflow.com/questions/26604605/user-input-in-z-fields-is-not-processed-in-customer-add-data-badi,"abap, sap-erp, badi",True
Purchase Requisition for asset services,1411972242,1,https://stackoverflow.com/questions/26093725/purchase-requisition-for-asset-services,"abap, sap-erp",False
Suggest BAPI for transaction AS01,1411113475,0,https://stackoverflow.com/questions/25929043/suggest-bapi-for-transaction-as01,"sap-erp, bapi",True
How to I find CAUFVD structure where filled in project builder of project system module?,1410862822,0,https://stackoverflow.com/questions/25866219/how-to-i-find-caufvd-structure-where-filled-in-project-builder-of-project-system,sap-erp,False
SAP transaction returns more columns than required,1410853145,0,https://stackoverflow.com/questions/25863148/sap-transaction-returns-more-columns-than-required,sap-erp,True
SAP .NET Connector BAPI_FUNCLOC_GETLIST RfcCommunicationException,1410449257,0,https://stackoverflow.com/questions/25791439/sap-net-connector-bapi-funcloc-getlist-rfccommunicationexception,"sap-erp, bapi, sap-dotnet-connector",True
Accessing SAP tables via JCo,1409821860,1,https://stackoverflow.com/questions/25661491/accessing-sap-tables-via-jco,"java, sap-erp, jco",False
Mule ESB: Not able to get older version of SAP Jco jars from SAP for Mule SAP Connector,1409625820,0,https://stackoverflow.com/questions/25615106/mule-esb-not-able-to-get-older-version-of-sap-jco-jars-from-sap-for-mule-sap-co,"mule, mule-studio, sap-erp, mule-el, jco",True
Call SAP webservice by PHP with parameters,1408347564,2,https://stackoverflow.com/questions/25358370/call-sap-webservice-by-php-with-parameters,"php, web-services, sap-erp, sap-basis",False
Print to Excel file instead of PDF in SAP ERP,1407414960,0,https://stackoverflow.com/questions/25182734/print-to-excel-file-instead-of-pdf-in-sap-erp,"excel, pdf-generation, export-to-excel, sap-erp",False
Standardized SAP ERP export format for invoices?,1406642535,0,https://stackoverflow.com/questions/25017287/standardized-sap-erp-export-format-for-invoices,sap-erp,True
CTE with Linked Server: Mulitpart Identifier could not be bound,1405621553,0,https://stackoverflow.com/questions/24810900/cte-with-linked-server-mulitpart-identifier-could-not-be-bound,"sql, sql-server, common-table-expression, linked-server, sap-erp",False
Oracle SQL Count with join,1405034649,0,https://stackoverflow.com/questions/24687889/oracle-sql-count-with-join,"sql, oracle-database, join, count, sap-erp",True
Is it possible to log/trace JMS message ID for specific Queue?,1404747174,0,https://stackoverflow.com/questions/24614357/is-it-possible-to-log-trace-jms-message-id-for-specific-queue,"jms, ibm-mq, sap-erp, sap-pi",True
Two web applications connecting to SAP BAPI using SAP JCo,1404362099,1,https://stackoverflow.com/questions/24545019/two-web-applications-connecting-to-sap-bapi-using-sap-jco,"java, sap-erp, jco",True
How to Consume SAP Web Service in C#,1404134075,1,https://stackoverflow.com/questions/24490998/how-to-consume-sap-web-service-in-c,"c#, asp.net, web-services, abap, sap-erp",True
Invalidating line of Purchase Requisition through ME_PROCESS_REQ_CUST,1402619760,0,https://stackoverflow.com/questions/24196031/invalidating-line-of-purchase-requisition-through-me-process-req-cust,"abap, sap-erp, badi",True
SAP RFC how to change date on a PM order,1401797099,0,https://stackoverflow.com/questions/24014747/sap-rfc-how-to-change-date-on-a-pm-order,"vb.net, sap-erp, saprfc",True
Mule-SAP Connector Error Message &quot;Please enter sold-to party or ship-to party&quot;,1401284031,0,https://stackoverflow.com/questions/23913133/mule-sap-connector-error-message-please-enter-sold-to-party-or-ship-to-party,"mule, sap-erp, saprfc",True
Identifying key field in SAP table while using JCo3,1401185219,1,https://stackoverflow.com/questions/23886556/identifying-key-field-in-sap-table-while-using-jco3,"abap, jco, bapi, sap-erp",True
SAP BAPI get all Functional Locations,1400677717,1,https://stackoverflow.com/questions/23784132/sap-bapi-get-all-functional-locations,"vba, visual-studio-2010, sap-erp, saprfc, bapi",True
MB_CREATE_GOODS_MOVEMENT returns subrc = 5 when running BAPI_GOODSMVT_CREATE,1398900735,2,https://stackoverflow.com/questions/23399841/mb-create-goods-movement-returns-subrc-5-when-running-bapi-goodsmvt-create,"abap, bapi, sap-erp",True
Connect SAP Retail using Java,1396515096,0,https://stackoverflow.com/questions/22832462/connect-sap-retail-using-java,"java, sap-erp, jco",True
Integration Primavera with SAP,1396020392,-1,https://stackoverflow.com/questions/22716954/integration-primavera-with-sap,"integration, sap-erp, primavera",False
Join COVP and GLPCA Tables,1395845955,1,https://stackoverflow.com/questions/22664926/join-covp-and-glpca-tables,"abap, opensql, sap-erp",True
Error Adding HU_CREATE_GOODSMVT_RFC with delphi TSAPFunction,1394539364,0,https://stackoverflow.com/questions/22325180/error-adding-hu-create-goodsmvt-rfc-with-delphi-tsapfunction,"delphi, sap-erp, saprfc",False
What is the difference between client &amp; company in SAP enterprise structure,1393836391,-2,https://stackoverflow.com/questions/22142185/what-is-the-difference-between-client-company-in-sap-enterprise-structure,sap-erp,False
Customer Address Data - Filter postal code by district,1393092243,0,https://stackoverflow.com/questions/21958208/customer-address-data-filter-postal-code-by-district,"street-address, postal-code, sap-erp, sap-crm",True
How to differentiate tax code per SAP module?,1392734007,0,https://stackoverflow.com/questions/21856899/how-to-differentiate-tax-code-per-sap-module,"percentage, sap-erp",True
Usage of bapi_vendor_find,1392507905,0,https://stackoverflow.com/questions/21805272/usage-of-bapi-vendor-find,"abap, bapi, sap-erp",True
Add a &lt;f:actionListener type=&quot;ListenerClass&quot;&gt; programmatically,1392136371,0,https://stackoverflow.com/questions/21707540/add-a-factionlistener-type-listenerclass-programmatically,"jsf, jakarta-ee, sap-erp",False
How to extract data from SAP through SSIS package?,1391617354,1,https://stackoverflow.com/questions/21582660/how-to-extract-data-from-sap-through-ssis-package,"ssis, etl, sap-erp",True
"ABAP TVRO field TRAZTD, Route Customizing Data",1390477883,0,https://stackoverflow.com/questions/21307346/abap-tvro-field-traztd-route-customizing-data,"csv, abap, sap-erp, customizing",False
SAP .NET Connector 3 with both R3 and ECC,1390296936,2,https://stackoverflow.com/questions/21254199/sap-net-connector-3-with-both-r3-and-ecc,"c#, sap-erp, sap-dotnet-connector, sap-r3",True
Sap Unique Employee number,1389283149,-1,https://stackoverflow.com/questions/21025055/sap-unique-employee-number,sap-erp,True
GOS attachments download,1389221777,4,https://stackoverflow.com/questions/21008336/gos-attachments-download,"abap, sap-erp",True
How to extend standard screen F-41,1389053835,1,https://stackoverflow.com/questions/20961757/how-to-extend-standard-screen-f-41,"abap, sap-erp, dynpro, badi",True
LEFT OUTER JOIN returns no rows,1386584285,1,https://stackoverflow.com/questions/20468059/left-outer-join-returns-no-rows,"abap, opensql, sap-erp",True
how to restrict the number of table columns in bapi output,1386393098,0,https://stackoverflow.com/questions/20437889/how-to-restrict-the-number-of-table-columns-in-bapi-output,"response, sap-erp, saprfc, bapi, jco",True
What is IDES SAP?,1384899985,-3,https://stackoverflow.com/questions/20083401/what-is-ides-sap,sap-erp,True
IW31 searching for a user exit or enh. point to get gsber,1383902257,2,https://stackoverflow.com/questions/19855350/iw31-searching-for-a-user-exit-or-enh-point-to-get-gsber,"hook, abap, sap-erp",True
Example program to insert a row using BAPI with JCO3,1382877090,2,https://stackoverflow.com/questions/19618055/example-program-to-insert-a-row-using-bapi-with-jco3,"sap-erp, bapi, sapjco3",True
User Exit EXIT_SAPLBARM_003,1381846345,1,https://stackoverflow.com/questions/19383433/user-exit-exit-saplbarm-003,"hook, abap, sap-erp",True
How to make custom field editable on item level in ME51n tcode?,1381332392,2,https://stackoverflow.com/questions/19276223/how-to-make-custom-field-editable-on-item-level-in-me51n-tcode,"abap, sap-erp, badi",True
Automating export of fs10n query from SAP using VBA,1380792083,3,https://stackoverflow.com/questions/19155407/automating-export-of-fs10n-query-from-sap-using-vba,"vba, automation, sap-gui, sap-erp",True
TIMS domain in SAP BW,1378477560,0,https://stackoverflow.com/questions/18660121/tims-domain-in-sap-bw,"abap, sap-erp, sap-bw",True
XLSO &amp; MM &quot;The group data for the material is locked by&quot; when creating courses,1377174206,0,https://stackoverflow.com/questions/18380322/xlso-mm-the-group-data-for-the-material-is-locked-by-when-creating-courses,"abap, sap-erp",True
Find materials by bill of material,1376977701,1,https://stackoverflow.com/questions/18327797/find-materials-by-bill-of-material,"abap, sap-erp",True
Reading and changing fields in SAP with RFC via VB .NET,1376915798,1,https://stackoverflow.com/questions/18313971/reading-and-changing-fields-in-sap-with-rfc-via-vb-net,"vb.net, sap-erp, saprfc",False
Function &#39;DEQUEUE_EMRKPF&#39; doesn&#39;t dequeue,1376400577,1,https://stackoverflow.com/questions/18210478/function-dequeue-emrkpf-doesnt-dequeue,"function, locking, abap, sap-erp",False
